{
  "bottle_rebuild": 0,
  "bottles": [
    {
      "arch": "wasm32",
      "bottle_tag": "wasm32_kandelo",
      "browser_compatible": false,
      "built_by": "https://github.com/kandelo-dev/homebrew-tap-core/actions/runs/32084923933",
      "built_from": {
        "formula_sha256": "787635f6f4f8a26037a64896e872b7f41e5ff8a03d40443d165abc7006a33d8e",
        "kandelo_commit": "a8d466b506af1883cdc82c179dc9ad42c4b77dc9",
        "kandelo_repository": "Automattic/kandelo",
        "tap_commit": "96d41e39bb4f7693c517155a6d66736c048634d1",
        "tap_repository": "kandelo-dev/homebrew-tap-core"
      },
      "bytes": 61164,
      "cache_key_sha": "58386197e0ef265d6280fe554e255d5b4832d3efd19d02b0598045c4308693fa",
      "cellar": "/opt/kandelo/homebrew/Cellar",
      "fork_instrumentation": "not-required",
      "kandelo_abi": 43,
      "link_manifest": "Kandelo/link/posix-utils-lite-0.1.0-rebuild0-wasm32.json",
      "prefix": "/opt/kandelo/homebrew",
      "runtime_support": [
        "node"
      ],
      "sha256": "58386197e0ef265d6280fe554e255d5b4832d3efd19d02b0598045c4308693fa",
      "status": "success",
      "url": "https://ghcr.io/v2/kandelo-dev/homebrew-tap-core-abi-43/posix-utils-lite/blobs/sha256:58386197e0ef265d6280fe554e255d5b4832d3efd19d02b0598045c4308693fa"
    }
  ],
  "dependencies": [],
  "formula_path": "Formula/posix-utils-lite.rb",
  "formula_revision": 0,
  "full_name": "kandelo-dev/tap-core/posix-utils-lite",
  "kandelo_abi": 43,
  "name": "posix-utils-lite",
  "schema": 1,
  "source_metadata": "Kandelo/metadata.json",
  "tap_commit": "7fd976c60986191daeb18f8c5c40dd705d71398f",
  "tap_name": "kandelo-dev/tap-core",
  "tap_repository": "kandelo-dev/homebrew-tap-core",
  "version": "0.1.0"
}
