{
  "schema": 1,
  "tap_repository": "kandelo-dev/homebrew-tap-core",
  "tap_name": "kandelo-dev/tap-core",
  "tap_commit": "1111111111111111111111111111111111111111",
  "kandelo_abi": 15,
  "source_metadata": "Kandelo/metadata.json",
  "name": "hello",
  "full_name": "kandelo-dev/tap-core/hello",
  "version": "2.12.1",
  "formula_revision": 0,
  "bottle_rebuild": 0,
  "formula_path": "Formula/hello.rb",
  "dependencies": [],
  "bottles": [
    {
      "arch": "wasm32",
      "bottle_tag": "wasm32_kandelo",
      "kandelo_abi": 15,
      "cellar": "/home/linuxbrew/.linuxbrew/Cellar",
      "prefix": "/home/linuxbrew/.linuxbrew",
      "url": "https://example.invalid/homebrew-tap-core/hello-2.12.1-rebuild0-wasm32_kandelo.bottle.tar.gz",
      "sha256": "bbbbbbbbbbbbbbbbbbbbbbbbbbbbbbbbbbbbbbbbbbbbbbbbbbbbbbbbbbbbbbbb",
      "bytes": 12345,
      "cache_key_sha": "cccccccccccccccccccccccccccccccccccccccccccccccccccccccccccccccc",
      "link_manifest": "Kandelo/link/hello-2.12.1-rebuild0-wasm32.json",
      "runtime_support": ["node"],
      "browser_compatible": false,
      "fork_instrumentation": "not-required",
      "status": "success",
      "built_by": "https://example.invalid/kandelo-dev/homebrew-tap-core/actions/runs/1",
      "built_from": {
        "kandelo_repository": "Automattic/kandelo",
        "kandelo_commit": "2222222222222222222222222222222222222222",
        "tap_repository": "kandelo-dev/homebrew-tap-core",
        "tap_commit": "1111111111111111111111111111111111111111",
        "formula_sha256": "aaaaaaaaaaaaaaaaaaaaaaaaaaaaaaaaaaaaaaaaaaaaaaaaaaaaaaaaaaaaaaaa"
      }
    }
  ]
}
