{
  "bottle_rebuild": 1,
  "bottles": [
    {
      "arch": "wasm32",
      "bottle_tag": "wasm32_kandelo",
      "browser_compatible": false,
      "built_at": "2026-07-24T13:13:25Z",
      "built_by": "https://github.com/kandelo-dev/homebrew-tap-core/actions/runs/30094542074",
      "built_from": {
        "formula_sha256": "44a51270db954dc77c63d411705a0128d978c9c96f02f0cebb0535eeb0f2d51c",
        "kandelo_commit": "2af878c5f31115fd963183accc7a660f03097355",
        "kandelo_repository": "Automattic/kandelo",
        "tap_commit": "7fd976c60986191daeb18f8c5c40dd705d71398f",
        "tap_repository": "kandelo-dev/homebrew-tap-core"
      },
      "cellar": "/home/linuxbrew/.linuxbrew/Cellar",
      "fork_instrumentation": "not-required",
      "kandelo_abi": 43,
      "prefix": "/home/linuxbrew/.linuxbrew",
      "runtime_support": [
        "node"
      ],
      "status": "pending"
    }
  ],
  "dependencies": [],
  "formula_path": "Formula/asa.rb",
  "formula_revision": 0,
  "full_name": "kandelo-dev/tap-core/asa",
  "kandelo_abi": 43,
  "name": "asa",
  "schema": 1,
  "source_metadata": "Kandelo/metadata.json",
  "tap_commit": "7fd976c60986191daeb18f8c5c40dd705d71398f",
  "tap_name": "kandelo-dev/tap-core",
  "tap_repository": "kandelo-dev/homebrew-tap-core",
  "version": "15.0.0"
}
