{
  "bottle_rebuild": 0,
  "bottles": [
    {
      "arch": "wasm32",
      "bottle_tag": "wasm32_kandelo",
      "browser_compatible": false,
      "built_by": "https://github.com/kandelo-dev/homebrew-tap-core/actions/runs/31864001372",
      "built_from": {
        "formula_sha256": "0db3c73bd8606ff75bba72f72e4ab69db143ae64c9ba4bb7f092caa2fcc53c50",
        "kandelo_commit": "7ca8cb2df61c16561197c1f395892976f1ae1390",
        "kandelo_repository": "Automattic/kandelo",
        "tap_commit": "717c79342f949ca5f0613be29d4ccd88408bd5f6",
        "tap_repository": "kandelo-dev/homebrew-tap-core"
      },
      "bytes": 4733336,
      "cache_key_sha": "ab56ec75fce858dd049236963e26b2e0fde1e140b844197950a6825a18968500",
      "cellar": "/opt/kandelo/homebrew/Cellar",
      "fork_instrumentation": "not-required",
      "kandelo_abi": 43,
      "link_manifest": "Kandelo/link/homebrew-bootstrap-6.0.12-153-gcf5bc21_1-rebuild0-wasm32.json",
      "prefix": "/opt/kandelo/homebrew",
      "runtime_support": [],
      "sha256": "ab56ec75fce858dd049236963e26b2e0fde1e140b844197950a6825a18968500",
      "status": "success",
      "url": "https://ghcr.io/v2/kandelo-dev/homebrew-tap-core-abi-43/homebrew-bootstrap/blobs/sha256:ab56ec75fce858dd049236963e26b2e0fde1e140b844197950a6825a18968500"
    }
  ],
  "dependencies": [],
  "formula_path": "Formula/homebrew-bootstrap.rb",
  "formula_revision": 1,
  "full_name": "kandelo-dev/tap-core/homebrew-bootstrap",
  "kandelo_abi": 43,
  "name": "homebrew-bootstrap",
  "schema": 1,
  "source_metadata": "Kandelo/metadata.json",
  "tap_commit": "99134c9439ece45065b330703c013fcf9e65366e",
  "tap_name": "kandelo-dev/tap-core",
  "tap_repository": "kandelo-dev/homebrew-tap-core",
  "version": "6.0.12-153-gcf5bc21_1"
}
