{
  "bottle_rebuild": 0,
  "bottles": [
    {
      "arch": "wasm32",
      "bottle_tag": "wasm32_kandelo",
      "browser_compatible": false,
      "built_at": "2026-07-20T07:52:56Z",
      "built_by": "https://github.com/kandelo-dev/homebrew-tap-core/actions/runs/29724870900",
      "built_from": {
        "formula_sha256": "04c528ac3d919a4d5083da2bba5e51e64f624c68b8bc989be8e959b5f70d65ad",
        "kandelo_commit": "2c98a8704275d8afc51f04b47d93501b2a4f9373",
        "kandelo_repository": "Automattic/kandelo",
        "tap_commit": "c675dd22ccd4a602059aa1aec00eb1e09076c7fa",
        "tap_repository": "kandelo-dev/homebrew-tap-core"
      },
      "bytes": 1096869,
      "cache_key_sha": "e461a9eed2839637ad061dd35d1b8569912e57a0daf84918f944f0bef3055595",
      "cellar": "/home/linuxbrew/.linuxbrew/Cellar",
      "fork_instrumentation": "not-required",
      "kandelo_abi": 41,
      "link_manifest": "Kandelo/link/libxml2-2.13.8_2-rebuild0-wasm32.json",
      "prefix": "/home/linuxbrew/.linuxbrew",
      "runtime_support": [
        "node"
      ],
      "sha256": "e461a9eed2839637ad061dd35d1b8569912e57a0daf84918f944f0bef3055595",
      "status": "success",
      "url": "https://ghcr.io/v2/kandelo-dev/homebrew-tap-core/libxml2/blobs/sha256:e461a9eed2839637ad061dd35d1b8569912e57a0daf84918f944f0bef3055595"
    }
  ],
  "dependencies": [
    {
      "name": "libiconv",
      "version": "1.19"
    },
    {
      "name": "zlib",
      "version": "1.3.1_4"
    }
  ],
  "formula_path": "Formula/libxml2.rb",
  "formula_revision": 2,
  "full_name": "kandelo-dev/tap-core/libxml2",
  "kandelo_abi": 41,
  "name": "libxml2",
  "schema": 1,
  "source_metadata": "Kandelo/metadata.json",
  "tap_commit": "6d0691de45a9b9dfab741ac42804d3e2ab58b8bc",
  "tap_name": "kandelo-dev/tap-core",
  "tap_repository": "kandelo-dev/homebrew-tap-core",
  "version": "2.13.8_2"
}
